{
  "$schema": "http://json-schema.org/draft-07/schema#",
  "$id": "behavioral-fsm-benchmark/generated_fsm/v1",
  "title": "Generated FSM",
  "type": "object",
  "required": ["states", "initial_state", "events", "transitions"],
  "properties": {
    "system_name": { "type": "string" },
    "domain": { "type": "string" },
    "metadata": { "type": "object" },
    "states": {
      "type": "array",
      "minItems": 1,
      "items": { "type": "string", "minLength": 1 }
    },
    "initial_state": { "type": "string", "minLength": 1 },
    "events": {
      "type": "array",
      "items": { "type": "string" }
    },
    "transitions": {
      "type": "array",
      "items": {
        "type": "object",
        "required": ["source", "event", "target"],
        "properties": {
          "source": { "type": "string" },
          "event": { "type": "string" },
          "target": { "type": "string" },
          "guard": { "type": "string" },
          "action": { "type": "string" },
          "requirement": { "type": "string" }
        },
        "additionalProperties": false
      }
    },
    "forbidden_behaviours": {
      "type": "array",
      "items": {
        "type": "object",
        "properties": {
          "trace": { "type": "array", "items": { "type": "string" } },
          "reason": { "type": "string" },
          "requirement": { "type": "string" }
        },
        "additionalProperties": false
      }
    }
  },
  "additionalProperties": false
}
